{
  "$schema": "https://json-schema.org/draft/2020-12/schema",
  "$id": "urn:benchweave-registry:records:1.1.0",
  "title": "BenchWeave registry lane records",
  "description": "Canonical-JSON review and lifecycle records committed in this repository. Structural validity does not establish trust; the records-validity CI and the admission replay are the machine checks, and identified human review is the accountable one.",
  "type": "object",
  "required": [
    "record_type",
    "record_version",
    "kind",
    "created_at",
    "actor"
  ],
  "properties": {
    "record_type": {
      "enum": [
        "review",
        "lifecycle"
      ]
    },
    "record_version": {
      "enum": [
        "1.0.0",
        "1.1.0"
      ],
      "description": "The 1.1.0 enum arm (issue #225 slice 3, F4): records valid at 1.1.0 add withdraw and the per-op required blocks; every 1.0.0 record stays valid forever \u2014 no restamp."
    },
    "kind": {
      "enum": [
        "admitted-release",
        "in-tree-fixture",
        "community-shared"
      ],
      "description": "CR-56 kind tag. Machine-checked at write time; a records entry without a kind is refused."
    },
    "created_at": {
      "type": "string",
      "format": "date-time"
    },
    "actor": {
      "type": "string",
      "minLength": 1,
      "description": "The GitHub identity responsible for this record."
    },
    "review": {
      "type": "object",
      "required": [
        "publisher",
        "plugin",
        "version",
        "checklist_id",
        "checklist_version",
        "reviewer_id",
        "outcome",
        "submission_manifest_sha256",
        "source_revision",
        "closure_digest",
        "capability_declaration",
        "platform_findings",
        "execution_model_disclosure",
        "components"
      ],
      "additionalProperties": false,
      "properties": {
        "publisher": {
          "type": "string",
          "pattern": "^[a-z0-9][a-z0-9-]*$"
        },
        "plugin": {
          "type": "string",
          "pattern": "^[a-z0-9][a-z0-9_-]*$"
        },
        "version": {
          "type": "string",
          "pattern": "^(0|[1-9][0-9]*)\\.(0|[1-9][0-9]*)\\.(0|[1-9][0-9]*)$"
        },
        "checklist_id": {
          "const": "review-checklist"
        },
        "checklist_version": {
          "const": "1"
        },
        "reviewer_id": {
          "type": "string",
          "minLength": 1,
          "description": "The identified accountable reviewer (CR-8)."
        },
        "outcome": {
          "enum": [
            "accepted",
            "changes-requested",
            "rejected"
          ]
        },
        "submission_manifest_sha256": {
          "type": "string",
          "pattern": "^[a-f0-9]{64}$",
          "description": "D_sub: the canonical digest of the reviewed submission manifest. Any post-review change to payload, source or pins breaks this pin and CI refuses (CR-11/CR-14)."
        },
        "source_revision": {
          "type": "string",
          "pattern": "^([a-f0-9]{40}|[a-f0-9]{64})$",
          "description": "The immutable commit digest the review ran against (CR-36)."
        },
        "closure_digest": {
          "type": "string",
          "pattern": "^[a-f0-9]{64}$",
          "description": "The dependency-closure digest the sign-off covered (CR-38); must equal the published release's closure digest."
        },
        "capability_declaration": {
          "type": "object",
          "required": [
            "network_egress",
            "subprocess_or_native_library",
            "filesystem_writes_beyond_evidence_retention"
          ],
          "additionalProperties": false,
          "properties": {
            "network_egress": {
              "type": "boolean"
            },
            "subprocess_or_native_library": {
              "type": "boolean"
            },
            "filesystem_writes_beyond_evidence_retention": {
              "type": "boolean"
            }
          },
          "description": "CR-45: the closed three-way enumeration; all-false is the explicit 'none'. Enforcement is deploy-policy only (Q13); this declaration is discovery input."
        },
        "platform_findings": {
          "type": "array",
          "minItems": 1,
          "items": {
            "type": "object",
            "required": [
              "source",
              "state"
            ],
            "additionalProperties": false,
            "properties": {
              "source": {
                "enum": [
                  "code-scanning",
                  "dependency-review",
                  "secret-scanning"
                ]
              },
              "state": {
                "enum": [
                  "consulted-no-findings",
                  "consulted-findings-addressed"
                ],
                "description": "Advisory to the accountable reviewer (CR-60); findings never mark a release verified (NFR-S1)."
              },
              "detail": {
                "type": "string",
                "minLength": 1
              }
            }
          },
          "description": "The platform findings consulted at the pinned revision (CR-60). A review record naming none is invalid under the same CI check that enforces CR-10."
        },
        "execution_model_disclosure": {
          "const": "in-process execution with full gateway authority; no Python sandbox",
          "description": "CR-52: the approval decision input states the execution model plainly; an approval recorded without it fails the audit check."
        },
        "cited_failures": {
          "type": "array",
          "minItems": 1,
          "items": {
            "type": "string",
            "minLength": 1
          },
          "description": "Failed requirement or checklist row ids. Required on changes-requested outcomes (CR-10)."
        },
        "notes": {
          "type": "string"
        },
        "components": {
          "type": "array",
          "minItems": 10,
          "maxItems": 10,
          "uniqueItems": true,
          "items": {
            "enum": [
              "adapter-source",
              "build-provenance",
              "capability-declaration",
              "closure-diff",
              "conformance-evidence",
              "dependency-lock",
              "descriptor",
              "licence",
              "payload-inventory",
              "release-manifest"
            ]
          },
          "description": "The CR-1 artefact-component set (A2): the same enumeration the publishing docs list and the SDK packaging tool refuses without \u2014 three-way equality is pinned by scripts/check_enumeration.py in CI. The reviewer confirms each component was present."
        }
      }
    },
    "lifecycle": {
      "type": "object",
      "required": [
        "op",
        "publisher",
        "plugin",
        "version",
        "reason"
      ],
      "additionalProperties": false,
      "properties": {
        "op": {
          "enum": [
            "publish",
            "yank",
            "advisory",
            "unlist",
            "takedown",
            "transfer",
            "withdraw"
          ]
        },
        "publisher": {
          "type": "string",
          "pattern": "^[a-z0-9][a-z0-9-]*$"
        },
        "plugin": {
          "type": "string",
          "pattern": "^[a-z0-9][a-z0-9_-]*$"
        },
        "version": {
          "type": "string",
          "pattern": "^(0|[1-9][0-9]*)\\.(0|[1-9][0-9]*)\\.(0|[1-9][0-9]*)$"
        },
        "reason": {
          "type": "string",
          "minLength": 1
        },
        "release_manifest_sha256": {
          "type": "string",
          "pattern": "^[a-f0-9]{64}$"
        },
        "closure": {
          "type": "object",
          "required": [
            "prior",
            "added",
            "changed",
            "removed"
          ],
          "additionalProperties": false,
          "properties": {
            "prior": {
              "oneOf": [
                {
                  "type": "null"
                },
                {
                  "type": "object",
                  "required": [
                    "version"
                  ],
                  "additionalProperties": false,
                  "properties": {
                    "version": {
                      "type": "string",
                      "pattern": "^(0|[1-9][0-9]*)\\.(0|[1-9][0-9]*)\\.(0|[1-9][0-9]*)$"
                    }
                  }
                }
              ]
            },
            "added": {
              "type": "array",
              "items": {
                "type": "string",
                "minLength": 1
              },
              "uniqueItems": true
            },
            "changed": {
              "type": "array",
              "items": {
                "type": "string",
                "minLength": 1
              },
              "uniqueItems": true
            },
            "removed": {
              "type": "array",
              "items": {
                "type": "string",
                "minLength": 1
              },
              "uniqueItems": true
            }
          },
          "description": "CR-38: dependencies added/changed/removed versus the prior release of the same package; prior is null on an initial release. Absent on a publish record is refused (closure_diff_absent)."
        },
        "closure_digest": {
          "type": "string",
          "pattern": "^[a-f0-9]{64}$"
        },
        "status_sequence": {
          "type": "integer",
          "minimum": 1,
          "description": "The status-document sequence this lifecycle op was recorded at (schema 1.1.0); the records-validity pair check pins ORDERING - the cited sequence must not exceed the sequence actually served, and later status rewrites (advisories after a yank) advance the served sequence without invalidating the historical record."
        },
        "advisory": {
          "type": "object",
          "required": [
            "id",
            "severity",
            "summary",
            "url"
          ],
          "additionalProperties": false,
          "properties": {
            "id": {
              "type": "string",
              "minLength": 1
            },
            "severity": {
              "enum": [
                "info",
                "low",
                "medium",
                "high",
                "critical"
              ],
              "description": "The vendored release-status schema's advisories severity enum (one authority; tests pin the two enums equal)."
            },
            "summary": {
              "type": "string",
              "minLength": 1
            },
            "url": {
              "type": "string",
              "format": "uri",
              "pattern": "^https://"
            }
          },
          "description": "The advisory this record appends to the release's status document (op advisory); the pair check requires the id in the served status's advisories[]."
        },
        "transfer": {
          "type": "object",
          "required": [
            "from_publisher",
            "to_publisher",
            "consents"
          ],
          "additionalProperties": false,
          "properties": {
            "from_publisher": {
              "type": "string",
              "minLength": 1
            },
            "to_publisher": {
              "type": "string",
              "minLength": 1
            },
            "consents": {
              "type": "array",
              "minItems": 2,
              "items": {
                "type": "string",
                "minLength": 1
              }
            },
            "vetting_reference": {
              "type": "string",
              "minLength": 1
            }
          }
        },
        "gateway_ref": {
          "type": "string",
          "pattern": "^([a-f0-9]{40}|[a-f0-9]{64})$",
          "description": "The pinned gateway commit this release targets \u2014 RECORDED AND ADVERTISED, never enforced at publish time (owner ruling, issue #223 rework: the registry states and advertises; the client enforces at import time). Absent means the release records no pin; nothing refuses."
        },
        "firmware_attestation": {
          "type": "object",
          "required": [
            "vendor",
            "manifest"
          ],
          "additionalProperties": false,
          "properties": {
            "vendor": {
              "type": "string",
              "minLength": 1
            },
            "manifest": {
              "type": "string",
              "minLength": 1
            },
            "bytes": {
              "const": "vendor-distributed"
            },
            "files": {
              "type": "array",
              "items": {
                "type": "string",
                "minLength": 1
              },
              "uniqueItems": true
            }
          },
          "description": "CR-50, stated-not-enforced (owner ruling, issue #223 rework): the vendor attestation recorded for a firmware-carrying release; enforcement is the client decision. Bytes are vendor-distributed, never bundled."
        },
        "signature_state": {
          "enum": [
            "signed-valid",
            "unsigned"
          ],
          "description": "The publisher-signature state this release was recorded with (owner ruling 2026-10-02): the registry validates + publishes + labels, never signs. A present signature that does not verify never reaches a record - validation rejects it before recording."
        },
        "timestamp": {
          "type": "object",
          "required": [
            "tsa",
            "signed_at",
            "signature_sha256",
            "token_sha256"
          ],
          "additionalProperties": false,
          "properties": {
            "tsa": {
              "type": "string",
              "minLength": 1
            },
            "signed_at": {
              "type": "string",
              "minLength": 13
            },
            "signature_sha256": {
              "type": "string",
              "pattern": "^[a-f0-9]{64}$"
            },
            "token_sha256": {
              "type": "string",
              "pattern": "^[a-f0-9]{64}$"
            }
          },
          "description": "The RFC 3161 trusted timestamp verified at recording: with one, the signature stays valid past key expiry/revocation (validity judged at the TSA-attested time)."
        },
        "timestamp_recommended": {
          "type": "boolean",
          "description": "Advisory (owner refinement 2026-10-02): timestamping is optional but recommended. True on a signed-but-untimestamped release - an un-timestamped signature is valid until the key expires; a timestamped one stays valid past expiry or revocation. Never a refusal."
        }
      }
    }
  },
  "additionalProperties": false,
  "allOf": [
    {
      "if": {
        "properties": {
          "record_type": {
            "const": "review"
          }
        }
      },
      "then": {
        "required": [
          "review"
        ]
      }
    },
    {
      "if": {
        "properties": {
          "record_type": {
            "const": "lifecycle"
          }
        }
      },
      "then": {
        "required": [
          "lifecycle"
        ]
      }
    },
    {
      "if": {
        "properties": {
          "record_type": {
            "const": "review"
          },
          "review": {
            "properties": {
              "outcome": {
                "const": "changes-requested"
              }
            }
          }
        }
      },
      "then": {
        "properties": {
          "review": {
            "required": [
              "cited_failures"
            ]
          }
        }
      }
    },
    {
      "if": {
        "properties": {
          "record_type": {
            "const": "lifecycle"
          },
          "lifecycle": {
            "properties": {
              "op": {
                "const": "publish"
              }
            }
          }
        }
      },
      "then": {
        "properties": {
          "lifecycle": {
            "required": [
              "release_manifest_sha256",
              "closure",
              "closure_digest",
              "signature_state"
            ]
          }
        }
      }
    },
    {
      "if": {
        "properties": {
          "record_type": {
            "const": "lifecycle"
          },
          "lifecycle": {
            "properties": {
              "op": {
                "const": "transfer"
              }
            }
          }
        }
      },
      "then": {
        "properties": {
          "lifecycle": {
            "required": [
              "transfer"
            ]
          }
        }
      }
    },
    {
      "if": {
        "properties": {
          "record_type": {
            "const": "lifecycle"
          },
          "lifecycle": {
            "properties": {
              "op": {
                "const": "yank"
              }
            }
          }
        }
      },
      "then": {
        "properties": {
          "lifecycle": {
            "required": [
              "release_manifest_sha256",
              "status_sequence"
            ]
          }
        }
      }
    },
    {
      "if": {
        "properties": {
          "record_type": {
            "const": "lifecycle"
          },
          "lifecycle": {
            "properties": {
              "op": {
                "const": "advisory"
              }
            }
          }
        }
      },
      "then": {
        "properties": {
          "lifecycle": {
            "required": [
              "advisory"
            ]
          }
        }
      }
    }
  ]
}
