{"actor":"madeinoz67","created_at":"2026-10-02T00:00:00Z","kind":"in-tree-fixture","lifecycle":{"op":"withdraw","plugin":"beta-tool","publisher":"northwind-instruments","reason":"contributor withdrew before acceptance (queue stage: withdrawn)","version":"1.0.0"},"record_type":"lifecycle","record_version":"1.1.0"}
