{"actor":"madeinoz67","created_at":"2026-10-02T00:00:00Z","kind":"in-tree-fixture","record_type":"review","record_version":"1.0.0","review":{"capability_declaration":{"filesystem_writes_beyond_evidence_retention":false,"network_egress":false,"subprocess_or_native_library":false},"checklist_id":"review-checklist","checklist_version":"1","closure_digest":"cccccccccccccccccccccccccccccccccccccccccccccccccccccccccccccccc","components":["adapter-source","build-provenance","capability-declaration","closure-diff","conformance-evidence","dependency-lock","descriptor","licence","payload-inventory","release-manifest"],"execution_model_disclosure":"in-process execution with full gateway authority; no Python sandbox","outcome":"accepted","platform_findings":[{"source":"code-scanning","state":"consulted-no-findings"}],"plugin":"gamma-tool","publisher":"northwind-instruments","reviewer_id":"madeinoz67","source_revision":"bbbbbbbbbbbbbbbbbbbbbbbbbbbbbbbbbbbbbbbb","submission_manifest_sha256":"aaaaaaaaaaaaaaaaaaaaaaaaaaaaaaaaaaaaaaaaaaaaaaaaaaaaaaaaaaaaaaaa","version":"1.0.0"}}
