{"actor":"madeinoz67","created_at":"2026-10-01T00:00:00Z","kind":"admitted-release","record_type":"review","record_version":"1.0.0","review":{"capability_declaration":{"filesystem_writes_beyond_evidence_retention":false,"network_egress":false,"subprocess_or_native_library":false},"checklist_id":"review-checklist","checklist_version":"1","closure_digest":"37517e5f3dc66819f61f5a7bb8ace1921282415f10551d2defa5c3eb0985b570","components":["adapter-source","build-provenance","capability-declaration","closure-diff","conformance-evidence","dependency-lock","descriptor","licence","payload-inventory","release-manifest"],"execution_model_disclosure":"in-process execution with full gateway authority; no Python sandbox","notes":"Slice-1 dogfood review (issue #223, design section 4 A1): the DPS-150 export at 45d5e7f packaged by benchweave-sdk package in one command, byte-reproducible on a second run. Machine evidence: the A4 entry-gate battery (6/6 refused, 6/6 controls pass), the A7 catalogue admission run under the active 0.1.2 schema, and the A2 three-way enumeration check. Executed by the owner's delegate agent on the owner's branch; the owner's merge is the countersignature. Reviewed against checklist v1 rows R-01..R-08 and P-01..P-07.","outcome":"accepted","platform_findings":[{"detail":"no findings to consult at record time: the lane's CodeQL workflow ships in the same push as this record; re-review fires on its first finding","source":"code-scanning","state":"consulted-no-findings"},{"detail":"no dependencies declared by this release (empty closure)","source":"dependency-review","state":"consulted-no-findings"},{"detail":"secret scanning with push protection configured on the repository; the refused-PEM fixture push is the slice's evidenced arm","source":"secret-scanning","state":"consulted-no-findings"}],"plugin":"dps150","publisher":"madeinoz67","reviewer_id":"madeinoz67","source_revision":"45d5e7fdc45dc6bbf765b1c8e85af70a2d830d94","submission_manifest_sha256":"b6debb1381078f3dbb43cd276aefb7ee6e7279b2190ff25b20f6b1a3b83ebf8a","version":"0.1.0"}}
