{"actor":"madeinoz67","created_at":"2026-10-02T00:00:00Z","kind":"in-tree-fixture","lifecycle":{"closure":{"added":[],"changed":[],"prior":null,"removed":[]},"closure_digest":"cccccccccccccccccccccccccccccccccccccccccccccccccccccccccccccccc","op":"publish","plugin":"alpha-tool","publisher":"northwind-instruments","reason":"fixture publish record (queue stage: published)","release_manifest_sha256":"dddddddddddddddddddddddddddddddddddddddddddddddddddddddddddddddd","signature_state":"unsigned","version":"1.0.0"},"record_type":"lifecycle","record_version":"1.0.0"}
