{"actor":"madeinoz67","created_at":"2026-10-01T00:00:00Z","kind":"admitted-release","lifecycle":{"closure":{"added":[],"changed":[],"prior":null,"removed":[]},"closure_digest":"37517e5f3dc66819f61f5a7bb8ace1921282415f10551d2defa5c3eb0985b570","gateway_ref":"45d5e7fdc45dc6bbf765b1c8e85af70a2d830d94","op":"publish","plugin":"dps150","publisher":"madeinoz67","reason":"slice-1 dogfooded release (issue #223, Q5): packaged, submitted, reviewed against checklist v1, signed, replayed","release_manifest_sha256":"e81ef419715ef563da313d754888be21f93a5dad7745d14fdc63284c55e484d3","signature_state":"signed-valid","version":"0.1.0"},"record_type":"lifecycle","record_version":"1.0.0"}
